{
  "$schema": "https://json-schema.org/draft/2020-12/schema",
  "title": "LLM Wiki SBOM Readiness Gate Report",
  "type": "object",
  "additionalProperties": false,
  "required": [
    "$schema",
    "vault",
    "generated_at",
    "sbom_mapping_report_ref",
    "status",
    "checks"
  ],
  "properties": {
    "$schema": {
      "type": "string",
      "enum": [
        "ops/schemas/sbom-readiness-gate-report.schema.json"
      ]
    },
    "vault": {
      "type": "string"
    },
    "generated_at": {
      "type": "string",
      "pattern": "^\\d{4}-\\d{2}-\\d{2}T\\d{2}:\\d{2}:\\d{2}Z$"
    },
    "artifact_kind": {
      "type": "string"
    },
    "producer": {
      "type": "string"
    },
    "source_command": {
      "type": "string"
    },
    "source_revision": {
      "type": "string"
    },
    "source_tree_fingerprint": {
      "type": "string"
    },
    "input_fingerprints": {
      "type": "object",
      "additionalProperties": {
        "type": "string"
      }
    },
    "schema_version": {
      "type": "integer",
      "minimum": 1
    },
    "artifact_status": {
      "type": "string",
      "enum": [
        "current",
        "archived",
        "stale",
        "unknown"
      ]
    },
    "retention_policy": {
      "type": "string",
      "enum": [
        "ephemeral",
        "canonical_report",
        "archive"
      ]
    },
    "encoding": {
      "type": "string",
      "enum": [
        "utf-8"
      ]
    },
    "currentness": {
      "$ref": "#/$defs/currentness"
    },
    "sbom_mapping_report_ref": {
      "type": "string"
    },
    "status": {
      "type": "string",
      "enum": [
        "pass",
        "fail"
      ]
    },
    "checks": {
      "type": "array",
      "minItems": 1,
      "items": {
        "$ref": "#/$defs/check"
      }
    }
  },
  "$defs": {
    "currentness": {
      "type": "object",
      "additionalProperties": false,
      "required": [
        "status",
        "checked_at"
      ],
      "properties": {
        "status": {
          "type": "string",
          "enum": [
            "current",
            "stale",
            "unknown",
            "invalid"
          ]
        },
        "checked_at": {
          "type": "string",
          "pattern": "^\\d{4}-\\d{2}-\\d{2}T\\d{2}:\\d{2}:\\d{2}Z$"
        }
      }
    },
    "check": {
      "type": "object",
      "additionalProperties": false,
      "required": [
        "rule",
        "pass"
      ],
      "properties": {
        "rule": {
          "type": "string"
        },
        "pass": {
          "type": "boolean"
        },
        "details": {
          "type": "string"
        }
      }
    }
  }
}
